Enter password: **********
Welcome to the MySQL monitor.  Commands end with ; or \g.
Your MySQL connection id is 21
Server version: 8.0.43 MySQL Community Server - GPL

Copyright (c) 2000, 2025, Oracle and/or its affiliates.

Oracle is a registered trademark of Oracle Corporation and/or its
affiliates. Other names may be trademarks of their respective
owners.

Type 'help;' or '\h' for help. Type '\c' to clear the current input statement.

mysql> use aug25;
Database changed
mysql> show tables;
+-----------------+
| Tables_in_aug25 |
+-----------------+
| countries       |
| department      |
| dept            |
| emp             |
| employee        |
| job_histry      |
| jobs            |
| room            |
| student         |
+-----------------+
9 rows in set (0.00 sec)

mysql> desc emp;
+---------+-------------+------+-----+---------+----------------+
| Field   | Type        | Null | Key | Default | Extra          |
+---------+-------------+------+-----+---------+----------------+
| eid     | int         | NO   | PRI | NULL    | auto_increment |
| name    | varchar(15) | NO   |     | NULL    |                |
| salary  | int         | YES  |     | NULL    |                |
| address | varchar(20) | YES  |     | pune    |                |
| dno     | int         | YES  | MUL | NULL    |                |
| age     | int         | YES  |     | NULL    |                |
| gender  | char(1)     | YES  |     | NULL    |                |
| j_date  | date        | YES  |     | NULL    |                |
+---------+-------------+------+-----+---------+----------------+
8 rows in set (0.00 sec)

mysql> table emp;
+-----+--------+--------+---------+------+------+--------+------------+
| eid | name   | salary | address | dno  | age  | gender | j_date     |
+-----+--------+--------+---------+------+------+--------+------------+
| 101 | Riya   |  25000 | pune    |    1 |   23 | F      | 2023-02-23 |
| 102 | ajay   |  25000 | pune    |    1 |   23 | M      | 2023-02-20 |
| 103 | Raj    |   NULL | mumbai  | NULL | NULL | M      | NULL       |
| 111 | Abhay  |  20000 | pune    |    2 | NULL | M      | NULL       |
| 121 | sakshi |  22000 | pune    |    2 | NULL | F      | NULL       |
| 122 | shyam  |  18000 | nagpur  |    1 |   26 | M      | 2024-05-12 |
| 123 | Neha   |   NULL | pune    | NULL | NULL | F      | NULL       |
+-----+--------+--------+---------+------+------+--------+------------+
7 rows in set (0.00 sec)

mysql> alter table dept
    -> ;
Query OK, 0 rows affected (0.00 sec)

mysql> table dept;
+-----+-------+----------+
| dno | name  | location |
+-----+-------+----------+
|   1 | IT    | pune     |
|   2 | Admin | mumbai   |
+-----+-------+----------+
2 rows in set (0.00 sec)

mysql> insert into dept values(3, "HR", "nagpur");
Query OK, 1 row affected (0.00 sec)

mysql> table dept;
+-----+-------+----------+
| dno | name  | location |
+-----+-------+----------+
|   1 | IT    | pune     |
|   2 | Admin | mumbai   |
|   3 | HR    | nagpur   |
+-----+-------+----------+
3 rows in set (0.00 sec)

mysql> update emp set dno = 3 where salary <= 20000;
Query OK, 2 rows affected (0.00 sec)
Rows matched: 2  Changed: 2  Warnings: 0

mysql> table emp;
+-----+--------+--------+---------+------+------+--------+------------+
| eid | name   | salary | address | dno  | age  | gender | j_date     |
+-----+--------+--------+---------+------+------+--------+------------+
| 101 | Riya   |  25000 | pune    |    1 |   23 | F      | 2023-02-23 |
| 102 | ajay   |  25000 | pune    |    1 |   23 | M      | 2023-02-20 |
| 103 | Raj    |   NULL | mumbai  | NULL | NULL | M      | NULL       |
| 111 | Abhay  |  20000 | pune    |    3 | NULL | M      | NULL       |
| 121 | sakshi |  22000 | pune    |    2 | NULL | F      | NULL       |
| 122 | shyam  |  18000 | nagpur  |    3 |   26 | M      | 2024-05-12 |
| 123 | Neha   |   NULL | pune    | NULL | NULL | F      | NULL       |
+-----+--------+--------+---------+------+------+--------+------------+
7 rows in set (0.00 sec)

mysql> insert into emp(name, age, gender) values("shubham", 25, 'M');
Query OK, 1 row affected (0.00 sec)

mysql> insert into emp(name, age, gender) values("mumbai", 25, 'M');
Query OK, 1 row affected (0.00 sec)

mysql> table emp;
+-----+---------+--------+---------+------+------+--------+------------+
| eid | name    | salary | address | dno  | age  | gender | j_date     |
+-----+---------+--------+---------+------+------+--------+------------+
| 101 | Riya    |  25000 | pune    |    1 |   23 | F      | 2023-02-23 |
| 102 | ajay    |  25000 | pune    |    1 |   23 | M      | 2023-02-20 |
| 103 | Raj     |   NULL | mumbai  | NULL | NULL | M      | NULL       |
| 111 | Abhay   |  20000 | pune    |    3 | NULL | M      | NULL       |
| 121 | sakshi  |  22000 | pune    |    2 | NULL | F      | NULL       |
| 122 | shyam   |  18000 | nagpur  |    3 |   26 | M      | 2024-05-12 |
| 123 | Neha    |   NULL | pune    | NULL | NULL | F      | NULL       |
| 124 | shubham |   NULL | pune    | NULL |   25 | M      | NULL       |
| 125 | mumbai  |   NULL | pune    | NULL |   25 | M      | NULL       |
+-----+---------+--------+---------+------+------+--------+------------+
9 rows in set (0.00 sec)

mysql> delete from emp where eid=125;
Query OK, 1 row affected (0.00 sec)

mysql> table emp;
+-----+---------+--------+---------+------+------+--------+------------+
| eid | name    | salary | address | dno  | age  | gender | j_date     |
+-----+---------+--------+---------+------+------+--------+------------+
| 101 | Riya    |  25000 | pune    |    1 |   23 | F      | 2023-02-23 |
| 102 | ajay    |  25000 | pune    |    1 |   23 | M      | 2023-02-20 |
| 103 | Raj     |   NULL | mumbai  | NULL | NULL | M      | NULL       |
| 111 | Abhay   |  20000 | pune    |    3 | NULL | M      | NULL       |
| 121 | sakshi  |  22000 | pune    |    2 | NULL | F      | NULL       |
| 122 | shyam   |  18000 | nagpur  |    3 |   26 | M      | 2024-05-12 |
| 123 | Neha    |   NULL | pune    | NULL | NULL | F      | NULL       |
| 124 | shubham |   NULL | pune    | NULL |   25 | M      | NULL       |
+-----+---------+--------+---------+------+------+--------+------------+
8 rows in set (0.00 sec)

mysql> create table emp1 as (select * from emp);
Query OK, 8 rows affected (0.02 sec)
Records: 8  Duplicates: 0  Warnings: 0

mysql> desc emp1;
+---------+-------------+------+-----+---------+-------+
| Field   | Type        | Null | Key | Default | Extra |
+---------+-------------+------+-----+---------+-------+
| eid     | int         | NO   |     | 0       |       |
| name    | varchar(15) | NO   |     | NULL    |       |
| salary  | int         | YES  |     | NULL    |       |
| address | varchar(20) | YES  |     | pune    |       |
| dno     | int         | YES  |     | NULL    |       |
| age     | int         | YES  |     | NULL    |       |
| gender  | char(1)     | YES  |     | NULL    |       |
| j_date  | date        | YES  |     | NULL    |       |
+---------+-------------+------+-----+---------+-------+
8 rows in set (0.00 sec)

mysql> table emp;
+-----+---------+--------+---------+------+------+--------+------------+
| eid | name    | salary | address | dno  | age  | gender | j_date     |
+-----+---------+--------+---------+------+------+--------+------------+
| 101 | Riya    |  25000 | pune    |    1 |   23 | F      | 2023-02-23 |
| 102 | ajay    |  25000 | pune    |    1 |   23 | M      | 2023-02-20 |
| 103 | Raj     |   NULL | mumbai  | NULL | NULL | M      | NULL       |
| 111 | Abhay   |  20000 | pune    |    3 | NULL | M      | NULL       |
| 121 | sakshi  |  22000 | pune    |    2 | NULL | F      | NULL       |
| 122 | shyam   |  18000 | nagpur  |    3 |   26 | M      | 2024-05-12 |
| 123 | Neha    |   NULL | pune    | NULL | NULL | F      | NULL       |
| 124 | shubham |   NULL | pune    | NULL |   25 | M      | NULL       |
+-----+---------+--------+---------+------+------+--------+------------+
8 rows in set (0.00 sec)

mysql> table emp1;
+-----+---------+--------+---------+------+------+--------+------------+
| eid | name    | salary | address | dno  | age  | gender | j_date     |
+-----+---------+--------+---------+------+------+--------+------------+
| 101 | Riya    |  25000 | pune    |    1 |   23 | F      | 2023-02-23 |
| 102 | ajay    |  25000 | pune    |    1 |   23 | M      | 2023-02-20 |
| 103 | Raj     |   NULL | mumbai  | NULL | NULL | M      | NULL       |
| 111 | Abhay   |  20000 | pune    |    3 | NULL | M      | NULL       |
| 121 | sakshi  |  22000 | pune    |    2 | NULL | F      | NULL       |
| 122 | shyam   |  18000 | nagpur  |    3 |   26 | M      | 2024-05-12 |
| 123 | Neha    |   NULL | pune    | NULL | NULL | F      | NULL       |
| 124 | shubham |   NULL | pune    | NULL |   25 | M      | NULL       |
+-----+---------+--------+---------+------+------+--------+------------+
8 rows in set (0.00 sec)

mysql> drop table emp1;
Query OK, 0 rows affected (0.01 sec)

mysql> table emp1;
ERROR 1146 (42S02): Table 'aug25.emp1' doesn't exist


mysql> alter table student
    -> modify column rollno int auto_increment;
Query OK, 2 rows affected (0.04 sec)
Records: 2  Duplicates: 0  Warnings: 0

mysql> desc student;
+------------+-------------+------+-----+---------+----------------+
| Field      | Type        | Null | Key | Default | Extra          |
+------------+-------------+------+-----+---------+----------------+
| email_id   | varchar(20) | YES  | UNI | NULL    |                |
| rollno     | int         | NO   | PRI | NULL    | auto_increment |
| name       | varchar(20) | NO   |     | NULL    |                |
| address    | varchar(25) | YES  |     | NULL    |                |
| gender     | char(1)     | YES  |     | NULL    |                |
| percentage | float(5,2)  | YES  |     | NULL    |                |
| mobNo      | int         | YES  |     | NULL    |                |
+------------+-------------+------+-----+---------+----------------+
7 rows in set (0.00 sec)

mysql> table student;
+----------------+--------+------+---------+--------+------------+-------+
| email_id       | rollno | name | address | gender | percentage | mobNo |
+----------------+--------+------+---------+--------+------------+-------+
| NULL           |    101 | Riya | NULL    | NULL   |      78.00 |  NULL |
| siya@gmail.com |    102 | siya | NULL    | NULL   |       NULL |  NULL |
+----------------+--------+------+---------+--------+------------+-------+
2 rows in set (0.00 sec)

mysql> insert into student(name, address, percentage) values("ajay", "pune", 80);
Query OK, 1 row affected (0.00 sec)

mysql> table student;
+----------------+--------+------+---------+--------+------------+-------+
| email_id       | rollno | name | address | gender | percentage | mobNo |
+----------------+--------+------+---------+--------+------------+-------+
| NULL           |    101 | Riya | NULL    | NULL   |      78.00 |  NULL |
| siya@gmail.com |    102 | siya | NULL    | NULL   |       NULL |  NULL |
| NULL           |    103 | ajay | pune    | NULL   |      80.00 |  NULL |
+----------------+--------+------+---------+--------+------------+-------+
3 rows in set (0.00 sec)

mysql> truncate student;
Query OK, 0 rows affected (0.02 sec)

mysql> table student;
Empty set (0.00 sec)

mysql> insert into student(name, address, gender) values("adesh", "Junnar", 'M');
Query OK, 1 row affected (0.00 sec)

mysql> table student;
+----------+--------+-------+---------+--------+------------+-------+
| email_id | rollno | name  | address | gender | percentage | mobNo |
+----------+--------+-------+---------+--------+------------+-------+
| NULL     |      1 | adesh | Junnar  | M      |       NULL |  NULL |
+----------+--------+-------+---------+--------+------------+-------+
1 row in set (0.00 sec)

mysql> alter table emp
    -> modify column j_date date auto_increment;
ERROR 1063 (42000): Incorrect column specifier for column 'j_date'
mysql> alter table emp
    -> modify column j_date date auto_increment;
ERROR 1063 (42000): Incorrect column specifier for column 'j_date'
mysql> update emp set j_date = "2024-10-02", salary = 24000 where name = "Neha or name = "shubham";
    "> "
    -> ;
ERROR 1064 (42000): You have an error in your SQL syntax; check the manual that corresponds to your MySQL server version for the right syntax to use near 'shubham";
"' at line 1
mysql> update emp set j_date = "2024-10-02", salary = 24000 where name = "Neha" or name = "shubham";
Query OK, 2 rows affected (0.00 sec)
Rows matched: 2  Changed: 2  Warnings: 0

mysql> table emp;
+-----+---------+--------+---------+------+------+--------+------------+
| eid | name    | salary | address | dno  | age  | gender | j_date     |
+-----+---------+--------+---------+------+------+--------+------------+
| 101 | Riya    |  25000 | pune    |    1 |   23 | F      | 2023-02-23 |
| 102 | ajay    |  25000 | pune    |    1 |   23 | M      | 2023-02-20 |
| 103 | Raj     |   NULL | mumbai  | NULL | NULL | M      | NULL       |
| 111 | Abhay   |  20000 | pune    |    3 | NULL | M      | NULL       |
| 121 | sakshi  |  22000 | pune    |    2 | NULL | F      | NULL       |
| 122 | shyam   |  18000 | nagpur  |    3 |   26 | M      | 2024-05-12 |
| 123 | Neha    |  24000 | pune    | NULL | NULL | F      | 2024-10-02 |
| 124 | shubham |  24000 | pune    | NULL |   25 | M      | 2024-10-02 |
| 126 | dipika  |  26000 | pune    |    2 | NULL | NULL   | 2025-01-15 |
+-----+---------+--------+---------+------+------+--------+------------+
9 rows in set (0.00 sec)